{
  "evidenceContextChars": 40,
  "maxDescriptionChars": 2000,
  "schemaWalkMaxDepth": 12,
  "schemaWalkMaxNodes": 2000,
  "injection": {
    "phrases": [
      {
        "phrase": "ignore previous",
        "requiresInstructionObject": true
      },
      {
        "phrase": "ignore all previous",
        "requiresInstructionObject": true
      },
      {
        "phrase": "disregard previous",
        "requiresInstructionObject": true
      },
      {
        "phrase": "disregard the above",
        "requiresInstructionObject": true
      },
      {
        "phrase": "do not tell the user"
      },
      {
        "phrase": "don't tell the user"
      },
      {
        "phrase": "without telling the user"
      },
      {
        "phrase": "do not mention this"
      },
      {
        "phrase": "before using any other tool"
      },
      {
        "phrase": "before doing anything else"
      },
      {
        "phrase": "you must first read"
      },
      {
        "phrase": "override your instructions"
      },
      {
        "phrase": "override the system"
      }
    ],
    "instructionObjects": [
      "instruction",
      "instructions",
      "prompt",
      "prompts",
      "message",
      "messages",
      "direction",
      "directions",
      "rule",
      "rules",
      "guidance",
      "context",
      "command",
      "commands",
      "order",
      "orders",
      "turn",
      "turns"
    ],
    "objectModifiers": [
      "the",
      "all",
      "any",
      "your",
      "my",
      "own",
      "above",
      "earlier",
      "prior",
      "user",
      "system",
      "assistant",
      "other"
    ],
    "note": "The whole of the injection heuristic: exact strings, not semantics. It deliberately does NOT match a bare 'ignore'/'override'/'system' anywhere in a description (that would fire on half the honest servers in the world), does NOT match the four phrases whose object is a plain noun in ordinary prose unless an instruction-object noun follows them (that is what requiresInstructionObject is for), and does NOT match paraphrases. A determined attacker rewrites around it; it exists to catch the copy-pasted payloads that make up nearly all of what is seen in the wild, without a false-positive rate that gets the whole report ignored. `instructionObjects` are the nouns that turn a phrase into an instruction override; `objectModifiers` are the filler allowed between the two."
  },
  "hiddenInstructions": {
    "htmlComment": {
      "source": "<!--[\\s\\S]*?-->",
      "flags": ""
    },
    "pseudoTag": {
      "source": "<\\/?(IMPORTANT|SYSTEM|INSTRUCTION|INSTRUCTIONS|SECRET|ADMIN)\\b[^>]*>",
      "flags": ""
    },
    "modelAddress": {
      "source": "note to (?:the )?(?:assistant|model|ai)\\b|ai instructions?:",
      "flags": "i"
    },
    "note": "Three shapes of text addressed to the model rather than to the reader. `htmlComment` does NOT match a lone opener or closer — an unterminated comment is a typo, not a payload. `pseudoTag` is case-SENSITIVE on purpose (note the absent i flag): the shouted form is the prompt-injection idiom and the lower-case forms are ordinary words inside real markup, so it does not match <b>, <code>, or any tag outside its six names. `modelAddress` matches the ADDRESS form only; a description that merely contains the word assistant does not fire."
  },
  "invisibleCodePointRanges": [
    [
      8203,
      8207
    ],
    [
      8234,
      8238
    ],
    [
      8288,
      8292
    ],
    [
      65279,
      65279
    ],
    [
      57344,
      63743
    ],
    [
      917504,
      917631
    ]
  ],
  "destructiveVerbs": [
    "delete",
    "deletes",
    "deleted",
    "deleting",
    "deletion",
    "deletions",
    "remove",
    "removes",
    "removed",
    "removing",
    "removal",
    "drop",
    "drops",
    "dropped",
    "dropping",
    "destroy",
    "destroys",
    "destroyed",
    "destroying",
    "purge",
    "purges",
    "purged",
    "purging",
    "truncate",
    "truncates",
    "truncated",
    "truncating",
    "revoke",
    "revokes",
    "revoked",
    "revoking",
    "terminate",
    "terminates",
    "terminated",
    "terminating",
    "wipe",
    "wipes",
    "wiped",
    "wiping",
    "erase",
    "erases",
    "erased",
    "erasing"
  ],
  "mutatingVerbsInName": [
    "delete",
    "deletes",
    "remove",
    "removes",
    "write",
    "writes",
    "create",
    "creates",
    "update",
    "updates",
    "insert",
    "inserts",
    "drop",
    "drops",
    "send",
    "sends",
    "post",
    "posts",
    "patch",
    "patches",
    "set",
    "sets",
    "put",
    "puts"
  ],
  "mutatingVerbsInDescription": [
    "deletes",
    "removes",
    "writes",
    "creates",
    "inserts",
    "drops",
    "sends"
  ],
  "readVerbsInName": [
    "get",
    "list",
    "read",
    "fetch",
    "describe",
    "search",
    "query",
    "find",
    "show"
  ],
  "weakMutatingVerbsInName": [
    "set",
    "sets",
    "put",
    "puts"
  ],
  "weakVerbMaxLeadingOffset": 1,
  "openWorldNameTerms": [
    "fetch",
    "fetches",
    "fetched",
    "fetching",
    "http",
    "https",
    "url",
    "urls",
    "uri",
    "uris",
    "web",
    "search",
    "searches",
    "searching",
    "browse",
    "browses",
    "browsing",
    "download",
    "downloads",
    "downloading",
    "upload",
    "uploads",
    "uploading",
    "remote"
  ],
  "openWorldDescriptionTerms": [
    "fetches",
    "fetched",
    "fetching",
    "searches",
    "searching",
    "browses",
    "browsing",
    "downloads",
    "downloading",
    "uploads",
    "uploading"
  ],
  "openWorldPhrase": {
    "source": "external\\s+api",
    "flags": "i"
  },
  "secretParameterPattern": {
    "source": "(^|_)(token|password|passwd|secret|api[_-]?key|apikey|credential|credentials|private[_-]?key|access[_-]?key)($|_)",
    "flags": ""
  },
  "secretParameterMeasurementSuffixes": [
    "count",
    "counts",
    "limit",
    "limits",
    "length",
    "size",
    "budget",
    "usage",
    "total",
    "totals",
    "type",
    "kind",
    "name",
    "names",
    "id",
    "ids",
    "index",
    "estimate",
    "ratio",
    "threshold",
    "max",
    "min",
    "profile",
    "format",
    "prefix",
    "suffix",
    "required",
    "enabled",
    "present"
  ],
  "broadOauthScopePatterns": [
    {
      "source": "^\\*$",
      "flags": "i"
    },
    {
      "source": "^all$",
      "flags": "i"
    },
    {
      "source": "^admin$",
      "flags": "i"
    },
    {
      "source": "^full[_-]?access$",
      "flags": "i"
    },
    {
      "source": "^.*:\\*$",
      "flags": "i"
    },
    {
      "source": "^(repo|write:org|admin:.*)$",
      "flags": "i"
    }
  ],
  "broadAllowedToolPatterns": [
    {
      "source": "^\\*$",
      "flags": "i"
    },
    {
      "source": "^(bash|shell|execute)$",
      "flags": "i"
    },
    {
      "source": "^(bash|shell|execute)\\(\\s*\\*\\s*\\)$",
      "flags": "i"
    }
  ],
  "skillScriptLangLabels": {
    "py": "python",
    "js": "javascript",
    "ts": "typescript",
    "sh": "shell",
    "bash": "shell",
    "rb": "ruby",
    "go": "go"
  },
  "skillNetworkRefPattern": {
    "source": "\\bhttps?:\\/\\/[^\\s\"'<>)]+",
    "flags": "i"
  },
  "note": "Every ageing literal the two security analyzers match on (RM-38 WP 2.1; the rules that consume them are apps/api/src/security/{analyzer,skill-analyzer,text-scan}.ts). Each list's `…Note` field is its false-positive review: what the list deliberately does NOT match, and why. Read it before adding a term — a heuristic that cries wolf is a heuristic nobody reads, and the near-miss fixtures in apps/api/test/security-*.test.ts are the standing proof that the negatives hold.",
  "invisibleCodePointRangesNote": "Code points a tool definition or a skill body has no legitimate reason to carry. Deliberately NOT matched: ordinary punctuation and accented letters — an em-dash, a curly quote, an accented vowel and every emoji sit outside these ranges, so text written by a human with a decent keyboard never fires. Nor a newline or a tab, which are legitimate in a long description and are escaped into visibility by the evidence redactor anyway. What IS matched is text invisible to a reader and meaningful to a model: zero-width spaces and joiners, the bidi overrides that let a name render backwards, the invisible math operators, the BOM, the Unicode TAG block (the smuggled-ASCII carrier), and the private-use area.",
  "destructiveVerbsNote": "Written out in every inflection rather than stemmed, because spelling the forms out is what makes the false-positive review reviewable. The token boundary is a non-alphanumeric, so a verb listed here does not match inside a longer word: the drop-down control and the un-prefixed undo verbs are both safe, and no stem can quietly pull in an unrelated noun.",
  "mutatingVerbsInNameNote": "Matched in the tool NAME, which is an identifier the server chose — a token here is a claim about what the tool does, never incidental prose. Deliberately absent: the past participles. Those describe a STATE the tool reads rather than an action it performs, and firing the analyzer's one error severity on a listing tool with an honest read-only hint is exactly the false positive that teaches an operator to stop reading the loudest severity in the report. `readVerbsInName` wins when it appears earlier in the name, and `weakMutatingVerbsInName` fire only from the leading verb position (see weakVerbMaxLeadingOffset) — both guards were added after a plain getter on three of the owner's own Qlik servers scored an error out of a noun.",